{
  "$schema": "https://raw.githubusercontent.com/iconmaster5326/YGOJSON/main/schema/v1/card.json",
  "id": "7ae6b3bf-9cda-4fe7-a161-c7f895a69800",
  "text": {
    "en": {
      "name": "Unity",
      "effect": "Select 1 monster on your side of the field. The DEF of the selected monster becomes equal to the combined original DEF of all face-up monsters on your side of the field, until the end of this turn."
    },
    "de": {
      "name": "Einheit",
      "effect": "W\u00e4hle ein Monster auf deinem Feld aus. Der DEF dieses Monsters wird zur Summe der urspr\u00fcnglichen DEF-Werte aller aufgedeckten Monster auf deinem Feld, bis deine End Phase beginnt."
    },
    "es": {
      "name": "Unidad",
      "effect": "Selecciona un Monstruo en tu campo. El DEF del Monstruo seleccionado pasa a ser la suma del DEF original de todos los Monstruos boca arriba en tu campo hasta tu End Phase."
    },
    "fr": {
      "name": "Alliance",
      "effect": "Choisissez un monstre sur votre Terrain. Les Points DEF de ce monstre deviennent la somme de tous les Points DEF des monstres pos\u00e9s face recto sur votre Terrain jusqu'\u00e0 votre End Phase."
    },
    "it": {
      "name": "Unit\u00e0",
      "effect": "Seleziona un Mostro presente nella tua parte di Campo. Fino alla tua End Phase, il valore DEF del Mostro selezionato diviene pari alla somma dei valori DEF di tutti i Mostri presenti scoperti nella tua parte di Campo."
    },
    "pt": {
      "name": "Unidade",
      "effect": "Selecione 1 monstro no seu lado do campo. A DEF do monstro selecionado se torna igual \u00e0 DEF original combinada de todos os monstros com a face para cima no seu lado do campo at\u00e9 o fim deste turno."
    },
    "ja": {
      "name": "\u7d50\u675f \uff35\uff2e\uff29\uff34\uff39",
      "effect": "\u2460\uff1a\u81ea\u5206\u30d5\u30a3\u30fc\u30eb\u30c9\u306e\u8868\u5074\u8868\u793a\u30e2\u30f3\u30b9\u30bf\u30fc\uff11\u4f53\u3092\u5bfe\u8c61\u3068\u3057\u3066\u767a\u52d5\u3067\u304d\u308b\u3002\u305d\u306e\u30e2\u30f3\u30b9\u30bf\u30fc\u306e\u5b88\u5099\u529b\u306f\u30bf\u30fc\u30f3\u7d42\u4e86\u6642\u307e\u3067\u3001\u81ea\u5206\u30d5\u30a3\u30fc\u30eb\u30c9\u306e\u5168\u3066\u306e\u8868\u5074\u8868\u793a\u30e2\u30f3\u30b9\u30bf\u30fc\u306e\u5143\u3005\u306e\u5b88\u5099\u529b\u3092\u5408\u8a08\u3057\u305f\u6570\u5024\u306b\u306a\u308b\u3002"
    },
    "ko": {
      "name": "\uacb0\uc18d UNITY",
      "effect": "\uc790\uc2e0\uc758 \ud544\ub4dc \uc704 \ubaac\uc2a4\ud130 1\uc7a5\uc744 \uc120\ud0dd\ud55c\ub2e4. \uc120\ud0dd\ud55c \ubaac\uc2a4\ud130\uc758 \uc218\ube44\ub825\uc740 \uc5d4\ub4dc \ud398\uc774\uc988\uae4c\uc9c0, \uc790\uc2e0\uc758 \ud544\ub4dc \uc704\uc5d0 \uc55e\uba74 \ud45c\uc2dc\ub85c \uc874\uc7ac\ud558\ub294 \ubaac\uc2a4\ud130 \uc804\ubd80\uc758 \uc6d0\ub798 \uc218\ube44\ub825\uc744 \ud569\uacc4\ud55c \uc218\uce58\uac00 \ub41c\ub2e4."
    },
    "zh-TW": {
      "name": "\u5718\u7d50 UNITY",
      "effect": "\u2460\uff1a\u53ef\u5c07\u6211\u65b9\u5834\u4e0a\u7684\uff11\u96bb\u6b63\u9762\u8868\u793a\u602a\u7378\u505a\u70ba\u5c0d\u8c61\u767c\u52d5\u3002\u8a72\u602a\u7378\u7684\u5b88\u5099\u529b\u5728\u56de\u5408\u7d50\u675f\u524d\uff0c\u8b8a\u70ba\u6211\u65b9\u5834\u4e0a\u6240\u6709\u6b63\u9762\u8868\u793a\u602a\u7378\u539f\u672c\u7684\u5b88\u5099\u529b\u7684\u5408\u8a08\u6578\u503c\u3002"
    },
    "zh-CN": {
      "name": "\u56e2\u7ed3 UNITY",
      "effect": "\u2460\uff1a\u4ee5\u81ea\u5df1\u573a\u4e0a1\u53ea\u8868\u4fa7\u8868\u793a\u602a\u517d\u4e3a\u5bf9\u8c61\u624d\u80fd\u53d1\u52a8\u3002\u90a3\u53ea\u602a\u517d\u7684\u5b88\u5907\u529b\u76f4\u5230\u56de\u5408\u7ed3\u675f\u65f6\u53d8\u6210\u81ea\u5df1\u573a\u4e0a\u7684\u5168\u90e8\u8868\u4fa7\u8868\u793a\u602a\u517d\u7684\u539f\u672c\u5b88\u5907\u529b\u5408\u8ba1\u6570\u503c\u3002"
    }
  },
  "cardType": "spell",
  "subcategory": "quickplay",
  "passwords": [
    "14731897"
  ],
  "images": [
    {
      "id": "ec309b5b-1715-4a25-a32a-d27487b6fe2f",
      "password": "14731897",
      "art": "https://images.ygoprodeck.com/images/cards_cropped/14731897.jpg",
      "card": "https://images.ygoprodeck.com/images/cards/14731897.jpg"
    }
  ],
  "sets": [
    "1882a77f-cdd2-4a2a-aba3-d5f786f52ded",
    "69b2fdc7-344c-4c00-8a3e-5ce8581a980c",
    "11f18aea-bdcf-462c-aedc-c83e68730902",
    "b650d14c-d74e-4674-b326-a7045b624ec6",
    "ec8720af-4bf6-41da-91a9-21ec1a4f1ea5",
    "166ee89f-e6fc-4642-b6b1-c5efc6db4873"
  ],
  "legality": {
    "tcg": {
      "current": "unlimited"
    },
    "ocg": {
      "current": "unlimited"
    }
  },
  "masterDuel": {
    "rarity": "ur",
    "craftable": true
  },
  "duelLinks": {
    "rarity": "ur"
  },
  "externalIDs": {
    "yugipedia": [
      {
        "name": "Unity",
        "id": 7406
      }
    ],
    "dbID": 5755,
    "ygoprodeck": {
      "id": 14731897,
      "name": "unity-1259"
    },
    "yamlyugiID": 14731897
  },
  "series": []
}