{
  "$schema": "https://raw.githubusercontent.com/iconmaster5326/YGOJSON/main/schema/v1/card.json",
  "id": "912364c8-8a40-4d4f-96bc-f204d039b580",
  "text": {
    "en": {
      "name": "Gogogo Giant",
      "official": false
    },
    "de": {
      "name": "Gogogo-Riese",
      "effect": "Wenn diese Karte als Normalbeschw\u00f6rung beschworen wird: Du kannst 1 \u201eGogogo\u201c-Monster in deinem Friedhof w\u00e4hlen; beschw\u00f6re das gew\u00e4hlte Ziel als Spezialbeschw\u00f6rung in die Verteidigungsposition, dann \u00e4ndere diese Karte in die Verteidigungsposition. Falls diese Karte angreift, wird sie am Ende der Battle Phase in die Verteidigungsposition ge\u00e4ndert."
    },
    "es": {
      "name": "Gigante Gogogo",
      "effect": "Cuando esta carta es Invocada de Modo Normal: puedes seleccionar 1 monstruo \"Gogogo\" en tu Cementerio; Invoca ese objetivo de Modo Especial en Posici\u00f3n de Defensa, y despu\u00e9s cambia esta carta a Posici\u00f3n de Defensa. Si esta carta ataca, se cambia a Posici\u00f3n de Defensa al final de la Battle Phase."
    },
    "fr": {
      "name": "G\u00e9ant Gogogo",
      "effect": "Lorsque cette carte est Invoqu\u00e9e Normalement : vous pouvez cibler 1 monstre \"Gogogo\" dans votre Cimeti\u00e8re ; Invoquez Sp\u00e9cialement la cible en Position de D\u00e9fense, puis changez cette carte en Position de D\u00e9fense. Si cette carte attaque, elle est chang\u00e9e en Position de D\u00e9fense \u00e0 la fin de la Battle Phase."
    },
    "it": {
      "name": "Gigante Gogogo",
      "effect": "Quando questa carta viene Evocata Normalmente: puoi scegliere come bersaglio 1 mostro \"Gogogo\" nel tuo Cimitero; Evoca Specialmente quel bersaglio in Posizione di Difesa, poi metti questa carta in Posizione di Difesa. Se questa carta attacca, essa viene messa in Posizione di Difesa alla fine della Battle Phase."
    },
    "pt": {
      "name": "Gigante Gogogo",
      "effect": "Quando este card for Invocado por Invoca\u00e7\u00e3o-Normal: voc\u00ea pode escolher 1 monstro \"Gogogo\" no seu Cemit\u00e9rio; Invoque o alvo por Invoca\u00e7\u00e3o-Especial em Posi\u00e7\u00e3o de Defesa e, depois, coloque este card em Posi\u00e7\u00e3o de Defesa. Se este card atacar, ele \u00e9 colocado em Posi\u00e7\u00e3o de Defesa no final da Fase de Batalha."
    },
    "ja": {
      "name": "\u30b4\u30b4\u30b4\u30b8\u30e3\u30a4\u30a2\u30f3\u30c8",
      "effect": "\u2460\uff1a\u3053\u306e\u30ab\u30fc\u30c9\u304c\u53ec\u559a\u306b\u6210\u529f\u3057\u305f\u6642\u3001\u81ea\u5206\u306e\u5893\u5730\u306e\u300c\u30b4\u30b4\u30b4\u300d\u30e2\u30f3\u30b9\u30bf\u30fc\uff11\u4f53\u3092\u5bfe\u8c61\u3068\u3057\u3066\u767a\u52d5\u3067\u304d\u308b\u3002\u305d\u306e\u30e2\u30f3\u30b9\u30bf\u30fc\u3092\u5b88\u5099\u8868\u793a\u3067\u7279\u6b8a\u53ec\u559a\u3059\u308b\u3002\u305d\u306e\u5f8c\u3001\u3053\u306e\u30ab\u30fc\u30c9\u306f\u5b88\u5099\u8868\u793a\u306b\u306a\u308b\u3002\u2461\uff1a\u3053\u306e\u30ab\u30fc\u30c9\u306f\u653b\u6483\u3057\u305f\u5834\u5408\u3001\u30d0\u30c8\u30eb\u30d5\u30a7\u30a4\u30ba\u7d42\u4e86\u6642\u306b\u5b88\u5099\u8868\u793a\u306b\u306a\u308b\u3002"
    },
    "ko": {
      "name": "\uace0\uace0\uace0 \uc790\uc774\uc5b8\ud2b8",
      "effect": "\u2460: \uc774 \uce74\ub4dc\uac00 \uc77c\ubc18 \uc18c\ud658\uc5d0 \uc131\uacf5\ud588\uc744 \ub54c, \uc790\uc2e0 \ubb18\uc9c0\uc758 \"\uace0\uace0\uace0\" \ubaac\uc2a4\ud130 1\uc7a5\uc744 \ub300\uc0c1\uc73c\ub85c \ud558\uace0 \ubc1c\ub3d9\ud560 \uc218 \uc788\ub2e4. \uadf8 \ubaac\uc2a4\ud130\ub97c \uc218\ube44 \ud45c\uc2dc\ub85c \ud2b9\uc218 \uc18c\ud658\ud55c\ub2e4. \uadf8 \ud6c4, \uc774 \uce74\ub4dc\ub294 \uc218\ube44 \ud45c\uc2dc\uac00 \ub41c\ub2e4. \u2461: \uc774 \uce74\ub4dc\ub294 \uacf5\uaca9\ud588\uc744 \uacbd\uc6b0, \ubc30\ud2c0 \ud398\uc774\uc988 \uc885\ub8cc\uc2dc\uc5d0 \uc218\ube44 \ud45c\uc2dc\uac00 \ub41c\ub2e4."
    },
    "zh-TW": {
      "name": "\u9686\u9686\u9686\u5de8\u4eba",
      "effect": "\u6b64\u5361\u53ec\u5524\u6210\u529f\u65f6\uff0c\u53ef\u9009\u62e9\u6211\u65b9\u5893\u57301\u53ea\u51a0\u6709\u300c\u9686\u9686\u9686\u300d\u540d\u79f0\u7684\u602a\u517d\uff0c\u5e76\u4e8e\u8868\u4fa7\u5b88\u5907\u8868\u793a\u8fdb\u884c\u7279\u522b\u53ec\u5524\u3002\u4e4b\u540e\uff0c\u6b64\u5361\u8f6c\u4e3a\u5b88\u5907\u8868\u793a\u3002\u53e6\u5916\uff0c\u6b64\u5361\u82e5\u8fdb\u884c\u4e86\u653b\u51fb\uff0c\u5728\u6218\u6597\u9636\u6bb5\u7ed3\u675f\u65f6\u5c06\u8f6c\u4e3a\u5b88\u5907\u8868\u793a\u3002"
    },
    "zh-CN": {
      "name": "\u9686\u9686\u9686\u5de8\u4eba",
      "effect": "\u2460\uff1a\u6b64\u5361\u53ec\u5524\u6210\u529f\u65f6\uff0c\u4ee5\u81ea\u5df1\u5893\u5730\u7684\uff11\u53ea\u201c\u9686\u9686\u9686\u201d\u602a\u517d\u4e3a\u5bf9\u8c61\u53ef\u4ee5\u53d1\u52a8\u3002\u4ee5\u5b88\u5907\u8868\u793a\u5f62\u5f0f\u5c06\u8be5\u602a\u517d\u7279\u6b8a\u53ec\u5524\u3002\u7136\u540e\u6b64\u5361\u53d8\u4e3a\u5b88\u5907\u8868\u793a\u3002\u2461\uff1a\u6b64\u5361\u653b\u51fb\u7684\u60c5\u51b5\u4e0b\uff0c\u6218\u6597\u9636\u6bb5\u7ed3\u675f\u65f6\u53d8\u4e3a\u5b88\u5907\u8868\u793a\u3002"
    }
  },
  "cardType": "monster",
  "attribute": "earth",
  "type": "rock",
  "classifications": [
    "effect"
  ],
  "level": 4,
  "atk": 2000,
  "def": 0,
  "passwords": [
    "39695323"
  ],
  "images": [
    {
      "id": "c8976d8a-3047-4502-ae6a-366abd29d946",
      "password": "39695323",
      "art": "https://images.ygoprodeck.com/images/cards_cropped/39695323.jpg",
      "card": "https://images.ygoprodeck.com/images/cards/39695323.jpg"
    }
  ],
  "sets": [
    "a7649aac-46ac-4d78-bf79-cab4c849ff6e",
    "a7649aac-46ac-4d78-bf79-cab4c849ff6e",
    "a7649aac-46ac-4d78-bf79-cab4c849ff6e",
    "a7649aac-46ac-4d78-bf79-cab4c849ff6e",
    "a7649aac-46ac-4d78-bf79-cab4c849ff6e",
    "a7649aac-46ac-4d78-bf79-cab4c849ff6e",
    "7db0c394-f18c-4364-ac02-598a32c1b67e",
    "7db0c394-f18c-4364-ac02-598a32c1b67e",
    "7db0c394-f18c-4364-ac02-598a32c1b67e",
    "7db0c394-f18c-4364-ac02-598a32c1b67e",
    "7db0c394-f18c-4364-ac02-598a32c1b67e",
    "7db0c394-f18c-4364-ac02-598a32c1b67e",
    "20b22e3a-b52c-41ed-920a-787ff7e7073b",
    "20b22e3a-b52c-41ed-920a-787ff7e7073b",
    "20b22e3a-b52c-41ed-920a-787ff7e7073b",
    "20b22e3a-b52c-41ed-920a-787ff7e7073b",
    "20b22e3a-b52c-41ed-920a-787ff7e7073b",
    "20b22e3a-b52c-41ed-920a-787ff7e7073b",
    "20b22e3a-b52c-41ed-920a-787ff7e7073b",
    "4cf4c3ee-d28c-4992-b908-63f97dcf3f74",
    "4cf4c3ee-d28c-4992-b908-63f97dcf3f74",
    "4cf4c3ee-d28c-4992-b908-63f97dcf3f74",
    "4cf4c3ee-d28c-4992-b908-63f97dcf3f74",
    "4cf4c3ee-d28c-4992-b908-63f97dcf3f74",
    "4cf4c3ee-d28c-4992-b908-63f97dcf3f74",
    "4cf4c3ee-d28c-4992-b908-63f97dcf3f74",
    "4cf4c3ee-d28c-4992-b908-63f97dcf3f74",
    "4cf4c3ee-d28c-4992-b908-63f97dcf3f74",
    "4cf4c3ee-d28c-4992-b908-63f97dcf3f74",
    "4cf4c3ee-d28c-4992-b908-63f97dcf3f74",
    "4cf4c3ee-d28c-4992-b908-63f97dcf3f74",
    "8d6bd298-3ef1-4965-bb1d-45fb970d8e9a",
    "8d6bd298-3ef1-4965-bb1d-45fb970d8e9a",
    "8d6bd298-3ef1-4965-bb1d-45fb970d8e9a",
    "8d6bd298-3ef1-4965-bb1d-45fb970d8e9a",
    "8d6bd298-3ef1-4965-bb1d-45fb970d8e9a",
    "d1ccd627-230c-4f05-9e0e-eaf8553e584e",
    "2ce4f1b7-ab57-477b-9c7b-eee2fb0b9b5d",
    "2ce4f1b7-ab57-477b-9c7b-eee2fb0b9b5d",
    "13500ddd-9d30-46f6-8e07-03532a7d3d39",
    "13500ddd-9d30-46f6-8e07-03532a7d3d39",
    "8ac90ec2-3330-43ab-8a7a-61bea7474144",
    "8ac90ec2-3330-43ab-8a7a-61bea7474144",
    "4c5e178b-e4d9-43fb-85d7-85ed02ce473d",
    "8647dd93-5460-442f-84e6-26dd6022fed0",
    "ef36aa55-e6b8-41ea-af9e-4a63da5f147e",
    "c37e37c3-7a04-45d6-9155-7975291020ee",
    "9890b3f7-abfc-414c-9bd1-347f2e5c7fba"
  ],
  "legality": {
    "tcg": {
      "current": "unlimited"
    },
    "ocg": {
      "current": "unlimited"
    }
  },
  "masterDuel": {
    "rarity": "sr",
    "craftable": true
  },
  "duelLinks": {
    "rarity": "r"
  },
  "externalIDs": {
    "yugipedia": [
      {
        "name": "Gogogo Giant",
        "id": 193339
      }
    ],
    "dbID": 9878,
    "ygoprodeck": {
      "id": 39695323,
      "name": "gogogo-giant-3361"
    },
    "yamlyugiID": 39695323
  },
  "series": [
    "26033d34-7056-45de-a10e-77f81cc3d1f5"
  ]
}