{
  "$schema": "https://raw.githubusercontent.com/iconmaster5326/YGOJSON/main/schema/v1/card.json",
  "id": "507afda0-de1e-4d93-a931-3de7994482b0",
  "text": {
    "en": {
      "name": "Warm Worm",
      "official": false
    },
    "de": {
      "name": "Warmer Wurm",
      "effect": "Falls diese Karte zerst\u00f6rt wird, lege die obersten 3 Karten vom Deck deines Gegners auf den Friedhof."
    },
    "es": {
      "name": "Gusano Ardiente",
      "effect": "Si esta carta es destruida, manda al Cementerio a las 3 cartas de la parte superior del Deck de tu adversario."
    },
    "fr": {
      "name": "Ver de Feu",
      "effect": "Si cette carte est d\u00e9truite, envoyez les 3 cartes du dessus du Deck de votre adversaire au Cimeti\u00e8re."
    },
    "it": {
      "name": "Verme Ardente",
      "effect": "Se questa carta viene distrutta, manda 3 carte del Deck del tuo avversario al Cimitero."
    },
    "pt": {
      "name": "Lombriga Ardente",
      "effect": "Se este card for destru\u00eddo, envie os 3 cards do topo do Deck do oponente para o Cemit\u00e9rio."
    },
    "ja": {
      "name": "\u30a6\u30a9\u30fc\u30e0\u30fb\u30ef\u30fc\u30e0",
      "effect": "\u2460\uff1a\u3053\u306e\u30ab\u30fc\u30c9\u304c\u7834\u58ca\u3055\u308c\u305f\u5834\u5408\u306b\u767a\u52d5\u3059\u308b\u3002\u76f8\u624b\u306e\u30c7\u30c3\u30ad\u306e\u4e0a\u304b\u3089\u30ab\u30fc\u30c9\u3092\uff13\u679a\u5893\u5730\u3078\u9001\u308b\u3002"
    },
    "ko": {
      "name": "\uc6b0\uc634 \uc6dc",
      "effect": "\uc774 \uce74\ub4dc\uac00 \ud30c\uad34\ub418\uc5c8\uc744 \uacbd\uc6b0, \uc0c1\ub300\uc758 \ub371 \uc704\uc5d0\uc11c \uce74\ub4dc\ub97c 3\uc7a5 \ubb18\uc9c0\ub85c \ubcf4\ub0b8\ub2e4."
    },
    "zh-TW": {
      "name": "\u6696\u7570\u87f2",
      "effect": "\u2460\uff1a\u5728\u6b64\u5361\u88ab\u7834\u58de\u7684\u72c0\u6cc1\u4e0b\u767c\u52d5\u3002\u5f9e\u5c0d\u65b9\u724c\u7d44\u4e0a\u65b9\u5c07\uff13\u5f35\u5361\u9001\u81f3\u5893\u5730\u3002"
    },
    "zh-CN": {
      "name": "\u6696\u866b",
      "effect": "\u2460\uff1a\u8fd9\u5f20\u5361\u88ab\u7834\u574f\u7684\u573a\u5408\u53d1\u52a8\u3002\u4ece\u5bf9\u65b9\u5361\u7ec4\u4e0a\u9762\u628a3\u5f20\u5361\u9001\u53bb\u5893\u5730\u3002"
    }
  },
  "cardType": "monster",
  "attribute": "fire",
  "type": "insect",
  "classifications": [
    "effect"
  ],
  "level": 3,
  "atk": 600,
  "def": 1400,
  "passwords": [
    "16751086"
  ],
  "images": [
    {
      "id": "3328e945-165f-409e-b0c7-ec480c01675f",
      "password": "16751086",
      "art": "https://images.ygoprodeck.com/images/cards_cropped/16751086.jpg",
      "card": "https://images.ygoprodeck.com/images/cards/16751086.jpg"
    }
  ],
  "sets": [
    "bbda8e12-e5c7-4746-9779-9d3b45c5f274",
    "bbda8e12-e5c7-4746-9779-9d3b45c5f274",
    "bbda8e12-e5c7-4746-9779-9d3b45c5f274",
    "bbda8e12-e5c7-4746-9779-9d3b45c5f274",
    "bbda8e12-e5c7-4746-9779-9d3b45c5f274",
    "bbda8e12-e5c7-4746-9779-9d3b45c5f274",
    "bbda8e12-e5c7-4746-9779-9d3b45c5f274",
    "eee52c01-808d-4796-bb87-f18c2d134843",
    "1834d6ae-ba04-4cb4-b15a-cd08c8f8aacb",
    "744d6edc-439a-4817-955b-3df1fa1a7ecf"
  ],
  "legality": {
    "tcg": {
      "current": "unlimited"
    },
    "ocg": {
      "current": "unlimited"
    }
  },
  "masterDuel": {
    "rarity": "r",
    "craftable": true
  },
  "duelLinks": {
    "rarity": "sr"
  },
  "externalIDs": {
    "yugipedia": [
      {
        "name": "Warm Worm",
        "id": 48242
      }
    ],
    "dbID": 8517,
    "ygoprodeck": {
      "id": 16751086,
      "name": "warm-worm-1441"
    },
    "yamlyugiID": 16751086
  },
  "series": [
    "6184491c-679a-4951-bb46-52bde1714507"
  ]
}