{
  "$schema": "https://raw.githubusercontent.com/iconmaster5326/YGOJSON/main/schema/v1/card.json",
  "id": "991b6004-d82d-4d40-9960-720bec05dff1",
  "text": {
    "en": {
      "name": "Dealer's Choice",
      "official": false
    },
    "de": {
      "name": "Wahl des Gebers",
      "effect": "Jeder Spieler mischt sein Deck, dann zieht jeder Spieler 1 Karte, dann wirft jeder Spieler 1 Karte ab."
    },
    "es": {
      "name": "Elecci\u00f3n del Repartidor",
      "effect": "Cada jugador baraja su Deck, y despu\u00e9s cada jugador roba 1 carta, y despu\u00e9s cada jugador descarta 1 carta."
    },
    "fr": {
      "name": "Choix du Donneur",
      "effect": "Chaque joueur m\u00e9lange son Deck, puis chaque joueur pioche 1 carte, puis chaque joueur d\u00e9fausse 1 carte."
    },
    "it": {
      "name": "Scelta del Banco",
      "effect": "Ogni giocatore mischia il suo Deck, poi ogni giocatore pesca 1 carta, poi ogni giocatore scarta 1 carta."
    },
    "pt": {
      "name": "Escolha do Carteador",
      "effect": "Cada duelista embaralha seu Deck e, depois, cada duelista compra 1 card e, depois, cada duelista descarta 1 card."
    },
    "ja": {
      "name": "\u30c7\u30a3\u30fc\u30e9\u30fc\u30ba\u30fb\u30c1\u30e7\u30a4\u30b9",
      "effect": "\u2460\uff1a\u304a\u4e92\u3044\u306e\u30d7\u30ec\u30a4\u30e4\u30fc\u306f\u3001\u30c7\u30c3\u30ad\u3092\u30b7\u30e3\u30c3\u30d5\u30eb\u3057\u3001\u30c7\u30c3\u30ad\u304b\u3089\uff11\u679a\u30c9\u30ed\u30fc\u3059\u308b\u3002\u305d\u306e\u5f8c\u3001\u304a\u4e92\u3044\u306e\u30d7\u30ec\u30a4\u30e4\u30fc\u306f\u624b\u672d\u3092\uff11\u679a\u9078\u3093\u3067\u6368\u3066\u308b\u3002"
    },
    "ko": {
      "name": "\ub51c\ub7ec\uc988 \ucd08\uc774\uc2a4",
      "effect": "\u2460: \uc591\ucabd \ud50c\ub808\uc774\uc5b4\ub294, \ub371\uc744 \uc154\ud50c\ud558\uace0, \ub371\uc5d0\uc11c 1\uc7a5 \ub4dc\ub85c\uc6b0\ud55c\ub2e4. \uadf8 \ud6c4, \uc591\ucabd \ud50c\ub808\uc774\uc5b4\ub294 \ud328\ub97c 1\uc7a5 \uace0\ub974\uace0 \ubc84\ub9b0\ub2e4."
    },
    "zh-TW": {
      "name": "\u838a\u5bb6\u9078\u64c7",
      "effect": "\u2460\uff1a\u96d9\u65b9\u73a9\u5bb6\u5c07\u724c\u7d44\u6d17\u724c\uff0c\u5f9e\u724c\u7d44\u62bd\uff11\u5f35\u724c\u3002\u5176\u5f8c\uff0c\u96d9\u65b9\u73a9\u5bb6\u9078\u64c7\uff11\u5f35\u624b\u724c\u6368\u68c4\u3002"
    },
    "zh-CN": {
      "name": "\u5e84\u5bb6\u9009\u62e9",
      "effect": "\u2460\uff1a\u53cc\u65b9\u73a9\u5bb6\u628a\u5361\u7ec4\u6d17\u5207\uff0c\u4ece\u5361\u7ec4\u62bd1\u5f20\u3002\u90a3\u4e4b\u540e\uff0c\u53cc\u65b9\u73a9\u5bb6\u90091\u5f20\u624b\u5361\u4e22\u5f03\u3002"
    }
  },
  "cardType": "trap",
  "subcategory": "normal",
  "passwords": [
    "89462956"
  ],
  "images": [
    {
      "id": "d4b551bc-0305-4dd9-9f93-a7fdf7861ded",
      "password": "89462956",
      "art": "https://images.ygoprodeck.com/images/cards_cropped/89462956.jpg",
      "card": "https://images.ygoprodeck.com/images/cards/89462956.jpg"
    }
  ],
  "sets": [
    "d835a743-3c32-4ef7-98fa-2f70967b5bdc",
    "d835a743-3c32-4ef7-98fa-2f70967b5bdc",
    "d835a743-3c32-4ef7-98fa-2f70967b5bdc",
    "d835a743-3c32-4ef7-98fa-2f70967b5bdc",
    "d835a743-3c32-4ef7-98fa-2f70967b5bdc",
    "d835a743-3c32-4ef7-98fa-2f70967b5bdc",
    "d835a743-3c32-4ef7-98fa-2f70967b5bdc",
    "d835a743-3c32-4ef7-98fa-2f70967b5bdc",
    "dc2d9920-87cd-4afd-adf8-65bc91d1057c",
    "dc2d9920-87cd-4afd-adf8-65bc91d1057c",
    "dc2d9920-87cd-4afd-adf8-65bc91d1057c",
    "dc2d9920-87cd-4afd-adf8-65bc91d1057c",
    "dc2d9920-87cd-4afd-adf8-65bc91d1057c",
    "dc2d9920-87cd-4afd-adf8-65bc91d1057c"
  ],
  "legality": {
    "tcg": {
      "current": "unlimited"
    },
    "ocg": {
      "current": "unlimited"
    }
  },
  "masterDuel": {
    "rarity": "n",
    "craftable": true
  },
  "externalIDs": {
    "yugipedia": [
      {
        "name": "Dealer's Choice",
        "id": 557472
      }
    ],
    "dbID": 13796,
    "ygoprodeck": {
      "id": 89462956,
      "name": "dealer-s-choice-9471"
    },
    "yamlyugiID": 89462956
  },
  "series": []
}