{
  "$schema": "https://raw.githubusercontent.com/iconmaster5326/YGOJSON/main/schema/v1/card.json",
  "id": "4db482e2-d7dd-474c-9e1f-9f5af87afabe",
  "text": {
    "en": {
      "name": "Krawler Ranvier",
      "effect": "FLIP: You can target up to 2 \"Krawler\" monsters in your GY; add them to your hand.\nIf this face-up card in its owner's control leaves the field because of an opponent's card effect: You can Special Summon 2 \"Krawler\" monsters with different names from your Deck in face-down Defense Position, except \"Krawler Ranvier\". You can only use each effect of \"Krawler Ranvier\" once per turn."
    },
    "fr": {
      "name": "Ranvier Krawler",
      "effect": "FLIP : Vous pouvez cibler max. 2 monstres \"Krawler\" dans votre Cimeti\u00e8re ; ajoutez-les \u00e0 votre main.\nSi cette carte face recto contr\u00f4l\u00e9e par son propri\u00e9taire quitte le Terrain \u00e0 cause d'un effet de carte de l'adversaire : vous pouvez Invoquer Sp\u00e9cialement 2 monstres \"Krawler\" (\"Ranvier Krawler\" exclu) de noms diff\u00e9rents depuis votre Deck en Position de D\u00e9fense face verso. Vous ne pouvez utiliser chaque effet de \"Ranvier Krawler\" qu'une fois par tour."
    },
    "de": {
      "name": "Krawler Ranvier",
      "effect": "FLIPP: Du kannst bis zu 2 \u201eKrawler\u201c-Monster in deinem Friedhof w\u00e4hlen; f\u00fcge sie deiner Hand hinzu.\nFalls diese offene Karte, die ihr Besitzer kontrolliert, das Spielfeld durch einen Karteneffekt eines Gegners verl\u00e4sst: Du kannst 2 \u201eKrawler\u201c-Monster mit unterschiedlichen Namen als Spezialbeschw\u00f6rung von deinem Deck in die verdeckte Verteidigungsposition beschw\u00f6ren, au\u00dfer \u201eKrawler Ranvier\u201c. Du kannst jeden Effekt von \u201eKrawler Ranvier\u201c nur einmal pro Spielzug verwenden."
    },
    "it": {
      "name": "Krawler Ranvier",
      "effect": "SCOPRI: Puoi scegliere come bersaglio fino a 2 mostri \"Krawler\" nel tuo Cimitero; aggiungili alla tua mano.\nSe questa carta scoperta sotto il controllo del suo proprietario lascia il Terreno a causa dell'effetto di una carta dell'avversario: puoi Evocare Specialmente 2 mostri \"Krawler\" con nomi diversi dal tuo Deck coperti in Posizione di Difesa, eccetto \"Krawler Ranvier\". Puoi utilizzare ogni effetto di \"Krawler Ranvier\" una sola volta per turno."
    },
    "pt": {
      "name": "Ranvier Krawler",
      "effect": "VIRE: Voc\u00ea pode escolher at\u00e9 2 monstros \"Krawler\" no seu Cemit\u00e9rio; adicione-os \u00e0 sua m\u00e3o.\nSe este card com a face para cima sob o controle do seu dono deixar o campo devido a um efeito de card do oponente: voc\u00ea pode Invocar por Invoca\u00e7\u00e3o-Especial 2 monstros \"Krawler\" com nomes diferentes do seu Deck em Posi\u00e7\u00e3o de Defesa com a face para baixo, exceto \"Ranvier Krawler\". Voc\u00ea s\u00f3 pode usar cada efeito de \"Ranvier Krawler\" uma vez por turno."
    },
    "es": {
      "name": "Krawler Ranvier",
      "effect": "VOLTEO: Puedes seleccionar hasta 2 monstruos \"Krawler\" en tu Cementerio; a\u00f1\u00e1delos a tu mano.\nSi esta carta boca arriba en control de su due\u00f1o deja el Campo por efecto de una carta de un adversario: puedes Invocar de Modo Especial, desde tu Deck, 2 monstruos \"Krawler\" con nombres diferentes, en Posici\u00f3n de Defensa boca abajo, excepto \"Krawler Ranvier\". S\u00f3lo puedes usar cada efecto de \"Krawler Ranvier\" una vez por turno."
    },
    "ja": {
      "name": "\u30af\u30ed\u30fc\u30e9\u30fc\u30fb\u30e9\u30f3\u30f4\u30a3\u30a8",
      "effect": "\u3053\u306e\u30ab\u30fc\u30c9\u540d\u306e\u2460\u2461\u306e\u52b9\u679c\u306f\u305d\u308c\u305e\u308c\uff11\u30bf\u30fc\u30f3\u306b\uff11\u5ea6\u3057\u304b\u4f7f\u7528\u3067\u304d\u306a\u3044\u3002\u2460\uff1a\u3053\u306e\u30ab\u30fc\u30c9\u304c\u30ea\u30d0\u30fc\u30b9\u3057\u305f\u5834\u5408\u3001\u81ea\u5206\u306e\u5893\u5730\u306e\u300c\u30af\u30ed\u30fc\u30e9\u30fc\u300d\u30e2\u30f3\u30b9\u30bf\u30fc\u3092\uff12\u4f53\u307e\u3067\u5bfe\u8c61\u3068\u3057\u3066\u767a\u52d5\u3067\u304d\u308b\u3002\u305d\u306e\u30e2\u30f3\u30b9\u30bf\u30fc\u3092\u624b\u672d\u306b\u52a0\u3048\u308b\u3002\u2461\uff1a\u8868\u5074\u8868\u793a\u306e\u3053\u306e\u30ab\u30fc\u30c9\u304c\u76f8\u624b\u306e\u52b9\u679c\u3067\u30d5\u30a3\u30fc\u30eb\u30c9\u304b\u3089\u96e2\u308c\u305f\u5834\u5408\u306b\u767a\u52d5\u3067\u304d\u308b\u3002\u300c\u30af\u30ed\u30fc\u30e9\u30fc\u30fb\u30e9\u30f3\u30f4\u30a3\u30a8\u300d\u4ee5\u5916\u306e\u300c\u30af\u30ed\u30fc\u30e9\u30fc\u300d\u30e2\u30f3\u30b9\u30bf\u30fc\uff12\u4f53\u3092\u30c7\u30c3\u30ad\u304b\u3089\u88cf\u5074\u5b88\u5099\u8868\u793a\u3067\u7279\u6b8a\u53ec\u559a\u3059\u308b\uff08\u540c\u540d\u30ab\u30fc\u30c9\u306f\uff11\u679a\u307e\u3067\uff09\u3002"
    },
    "ko": {
      "name": "\ud06c\ub864\ub7ec \ub791\ube44\uc5d0",
      "effect": "\uc774 \uce74\ub4dc\uc758 \u2460\u2461\uc758 \ud6a8\uacfc\ub294 \uac01\uac01 1\ud134\uc5d0 1\ubc88\ubc16\uc5d0 \uc0ac\uc6a9\ud560 \uc218 \uc5c6\ub2e4. \u2460 : \uc774 \uce74\ub4dc\uac00 \ub9ac\ubc84\uc2a4\ud588\uc744 \uacbd\uc6b0, \uc790\uc2e0\uc758 \ubb18\uc9c0\uc758 \"\ud06c\ub864\ub7ec\" \ubaac\uc2a4\ud130\ub97c 2\uc7a5\uae4c\uc9c0 \ub300\uc0c1\uc73c\ub85c \ud558\uace0 \ubc1c\ub3d9\ud560 \uc218 \uc788\ub2e4. \uadf8 \ubaac\uc2a4\ud130\ub97c \ud328\uc5d0 \ub123\ub294\ub2e4. \u2461 : \uc55e\uba74 \ud45c\uc2dc\uc758 \uc774 \uce74\ub4dc\uac00 \uc0c1\ub300 \ud6a8\uacfc\ub85c \ud544\ub4dc\uc5d0\uc11c \ubc97\uc5b4\ub0ac\uc744 \uacbd\uc6b0\uc5d0 \ubc1c\ub3d9\ud560 \uc218 \uc788\ub2e4. \"\ud06c\ub864\ub7ec \ub791\ube44\uc5d0\" \uc774\uc678\uc758 \"\ud06c\ub864\ub7ec\" \ubaac\uc2a4\ud130 2\uc7a5\uc744 \ub371\uc5d0\uc11c \ub4b7\uba74 \uc218\ube44 \ud45c\uc2dc\ub85c \ud2b9\uc218 \uc18c\ud658\ud55c\ub2e4(\uac19\uc740 \uc774\ub984\uc758 \uce74\ub4dc\ub294 1\uc7a5\uae4c\uc9c0)."
    },
    "zh-CN": {
      "name": "\u673a\u602a\u866b\u30fb\u5170\u6c0f\u7ed3",
      "effect": "\u6b64\u5361\u540d\u7684\u2460\u2461\u6548\u679c1\u56de\u5408\u4ec5\u53ef\u5404\u4f7f\u75281\u6b21\u3002\u2460\uff1a\u6b64\u5361\u53cd\u8f6c\u7684\u60c5\u51b5\u4e0b\uff0c\u4ee5\u81ea\u5df1\u5893\u5730\u6700\u591a2\u53ea\u201c\u673a\u602a\u866b\u201d\u602a\u517d\u4e3a\u5bf9\u8c61\u53ef\u4ee5\u53d1\u52a8\u3002\u5c06\u8be5\u602a\u517d\u52a0\u5165\u624b\u724c\u3002\u2461\uff1a\u8868\u4fa7\u8868\u793a\u7684\u6b64\u5361\u56e0\u5bf9\u624b\u7684\u6548\u679c\u4ece\u573a\u4e0a\u79bb\u5f00\u7684\u60c5\u51b5\u4e0b\u53ef\u4ee5\u53d1\u52a8\u3002\u5c062\u53ea\u201c\u673a\u602a\u866b\u30fb\u5170\u6c0f\u7ed3\u201d\u4ee5\u5916\u7684\u201c\u673a\u602a\u866b\u201d\u602a\u517d\u4ece\u724c\u7ec4\u4ee5\u91cc\u4fa7\u5b88\u5907\u8868\u793a\u7279\u6b8a\u53ec\u5524\uff08\u540c\u540d\u5361\u6700\u591a1\u5f20\uff09\u3002"
    }
  },
  "cardType": "monster",
  "attribute": "earth",
  "type": "insect",
  "classifications": [
    "effect"
  ],
  "abilities": [
    "flip"
  ],
  "level": 2,
  "atk": 1100,
  "def": 900,
  "passwords": [
    "10698416"
  ],
  "images": [
    {
      "id": "0c06ec8c-8c9c-45dd-94a1-617568c8505a",
      "password": "10698416",
      "art": "https://images.ygoprodeck.com/images/cards_cropped/10698416.jpg",
      "card": "https://images.ygoprodeck.com/images/cards/10698416.jpg"
    }
  ],
  "sets": [
    "b4c2ad27-64e6-47af-8f72-d9461d8915f8",
    "b4c2ad27-64e6-47af-8f72-d9461d8915f8",
    "b4c2ad27-64e6-47af-8f72-d9461d8915f8",
    "b4c2ad27-64e6-47af-8f72-d9461d8915f8",
    "b4c2ad27-64e6-47af-8f72-d9461d8915f8",
    "b4c2ad27-64e6-47af-8f72-d9461d8915f8",
    "b4c2ad27-64e6-47af-8f72-d9461d8915f8",
    "b4c2ad27-64e6-47af-8f72-d9461d8915f8",
    "9d106e04-53eb-4f3c-80f7-efc0b2433d45",
    "f3d792c7-f3ff-482e-bf07-9eaf178e7280",
    "4e3badf1-d1a1-4444-972b-223d53d1b3f2"
  ],
  "legality": {
    "tcg": {
      "current": "unlimited"
    },
    "ocg": {
      "current": "unlimited"
    }
  },
  "masterDuel": {
    "rarity": "n",
    "craftable": true
  },
  "duelLinks": {
    "rarity": "n"
  },
  "externalIDs": {
    "yugipedia": [
      {
        "name": "Krawler Ranvier",
        "id": 519678
      }
    ],
    "dbID": 13236,
    "ygoprodeck": {
      "id": 10698416,
      "name": "krawler-ranvier-8693"
    },
    "yamlyugiID": 10698416
  },
  "series": [
    "eaab5178-3cc7-4c12-9346-f9a49d022aa0"
  ]
}