{
  "$schema": "https://raw.githubusercontent.com/iconmaster5326/YGOJSON/main/schema/v1/card.json",
  "id": "780c033f-c512-4e30-9385-4f993ebe52e2",
  "text": {
    "en": {
      "name": "Lekunga",
      "effect": "You can banish 2 WATER monsters from your Graveyard; Special Summon 1 \"Lekunga Token\" (Plant-Type/WATER/Level 2/ATK 700/DEF 700) in Attack Position."
    },
    "de": {
      "name": "Lekunga",
      "effect": "Du kannst 2 WASSER Monster von deinem Friedhof verbannen; beschw\u00f6re 1 \u201eLekunga-Spielmarke\u201c (Typ Pflanze/WASSER/Stufe 2/ATK 700/DEF 700) als Spezialbeschw\u00f6rung in die Angriffsposition."
    },
    "es": {
      "name": "Lekunga",
      "effect": "Puedes desterrar 2 monstruos de AGUA en tu Cementerio; Invoca de Modo Especial 1 \"Ficha de Lekunga\" (Tipo Planta/AGUA/Nivel 2/ATK 700/DEF 700) en Posici\u00f3n de Ataque."
    },
    "fr": {
      "name": "Lekunga",
      "effect": "Vous pouvez bannir 2 monstres EAU depuis votre Cimeti\u00e8re ; Invoquez Sp\u00e9cialement 1 \"Jeton Lekunga\" (Type Plante/EAU/Niveau 2/ATK 700/DEF 700) en Position d'Attaque."
    },
    "it": {
      "name": "Lekunga",
      "effect": "Puoi bandire 2 mostri ACQUA dal tuo Cimitero; Evoca Specialmente 1 \"Segna-Lekunga\" (Tipo Pianta/ACQUA/ Livello 2/ATK 700/DEF 700) in Posizione d'Attacco."
    },
    "pt": {
      "name": "Lekunga",
      "effect": "Voc\u00ea pode banir 2 monstros de \u00c1GUA do seu Cemit\u00e9rio; Invoque por Invoca\u00e7\u00e3o-Especial 1 \"Ficha de Lekunga\" (Tipo Planta/\u00c1GUA/N\u00edvel 2/ATK 700/DEF 700) em Posi\u00e7\u00e3o de Ataque."
    },
    "ja": {
      "name": "\u30ec\u30af\u30f3\u30ac",
      "effect": "\u81ea\u5206\u306e\u5893\u5730\u306e\u6c34\u5c5e\u6027\u30e2\u30f3\u30b9\u30bf\u30fc\uff12\u4f53\u3092\u30b2\u30fc\u30e0\u304b\u3089\u9664\u5916\u3059\u308b\u5ea6\u306b\u3001\u81ea\u5206\u30d5\u30a3\u30fc\u30eb\u30c9\u4e0a\u306b\u300c\u30ec\u30af\u30f3\u30ac\u30c8\u30fc\u30af\u30f3\u300d\uff08\u690d\u7269\u65cf\u30fb\u6c34\u30fb\u661f\uff12\u30fb\u653b\uff0f\u5b88\uff17\uff10\uff10\uff09\u3092\uff11\u4f53\u653b\u6483\u8868\u793a\u3067\u7279\u6b8a\u53ec\u559a\u3059\u308b\u3002"
    },
    "ko": {
      "name": "\ub808\ucfe4\uac00",
      "effect": "\uc790\uc2e0\uc758 \ubb18\uc9c0\uc758 \ubb3c \uc18d\uc131 \ubaac\uc2a4\ud130 2\uc7a5\uc744 \uac8c\uc784\uc5d0\uc11c \uc81c\uc678\ud560 \ub54c\ub9c8\ub2e4, \uc790\uc2e0 \ud544\ub4dc \uc704\uc5d0 \"\ub808\ucfe4\uac00 \ud1a0\ud070\"(\uc2dd\ubb3c\uc871/\ubb3c \uc18d\uc131/\ub808\ubca8 2/\uacf5\uaca9\ub825 700/\uc218\ube44\ub825 700)\uc744 1\uc7a5 \uacf5\uaca9 \ud45c\uc2dc\ub85c \ud2b9\uc218 \uc18c\ud658\ud55c\ub2e4."
    },
    "zh-TW": {
      "name": "\u88c2\u8548\u7259",
      "effect": "\u53ef\u5c07\u6211\u65b9\u5893\u5730\u7684\uff12\u96bb\u6c34\u5c6c\u6027\u602a\u7378\u5f9e\u904a\u6232\u9664\u5916\u767c\u52d5\u3002\u4ee5\u653b\u64ca\u8868\u793a\u7279\u6b8a\u53ec\u559a\uff11\u96bb\u300c\u88c2\u8548\u7259\u884d\u751f\u7269\u300d\uff08\u690d\u7269\u65cf\u30fb\u6c34\u30fb\u661f\uff12\u30fb\u653b\uff0f\u5b88\uff17\uff10\uff10\uff09\u81f3\u6211\u65b9\u5834\u4e0a\u3002"
    },
    "zh-CN": {
      "name": "\u88c2\u8548\u7259",
      "effect": "\u6bcf\u628a\u81ea\u5df1\u5893\u57302\u53ea\u6c34\u5c5e\u6027\u602a\u517d\u4ece\u6e38\u620f\u4e2d\u9664\u5916\uff0c\u5728\u81ea\u5df1\u573a\u4e0a\u628a1\u53ea\u300c\u88c2\u8548\u7259\u884d\u751f\u7269\u300d\uff08\u690d\u7269\u65cf\u00b7\u6c34\u00b72\u661f\u00b7\u653b\uff0f\u5b88700\uff09\u653b\u51fb\u8868\u793a\u7279\u6b8a\u53ec\u5524\u3002"
    }
  },
  "cardType": "monster",
  "attribute": "water",
  "type": "plant",
  "classifications": [
    "effect"
  ],
  "level": 4,
  "atk": 1700,
  "def": 500,
  "passwords": [
    "62543393"
  ],
  "images": [
    {
      "id": "ee134cce-fc76-4edc-9747-0308214a63b7",
      "password": "62543393",
      "art": "https://images.ygoprodeck.com/images/cards_cropped/62543393.jpg",
      "card": "https://images.ygoprodeck.com/images/cards/62543393.jpg"
    }
  ],
  "sets": [
    "a13c4f24-0b0a-4461-a4df-841ea78f465a",
    "a13c4f24-0b0a-4461-a4df-841ea78f465a",
    "a13c4f24-0b0a-4461-a4df-841ea78f465a",
    "a13c4f24-0b0a-4461-a4df-841ea78f465a",
    "a13c4f24-0b0a-4461-a4df-841ea78f465a",
    "59b221d4-45c5-4a46-b773-e73d04bcabd3",
    "59b221d4-45c5-4a46-b773-e73d04bcabd3",
    "59b221d4-45c5-4a46-b773-e73d04bcabd3",
    "59b221d4-45c5-4a46-b773-e73d04bcabd3",
    "59b221d4-45c5-4a46-b773-e73d04bcabd3",
    "59b221d4-45c5-4a46-b773-e73d04bcabd3",
    "3551adc1-0042-4625-a113-a88b942e4b60",
    "3551adc1-0042-4625-a113-a88b942e4b60",
    "3551adc1-0042-4625-a113-a88b942e4b60",
    "3551adc1-0042-4625-a113-a88b942e4b60",
    "3551adc1-0042-4625-a113-a88b942e4b60",
    "3551adc1-0042-4625-a113-a88b942e4b60",
    "3551adc1-0042-4625-a113-a88b942e4b60",
    "3551adc1-0042-4625-a113-a88b942e4b60",
    "ecdcbae7-7a8c-4cd1-97d6-31732c5d0db7",
    "ecdcbae7-7a8c-4cd1-97d6-31732c5d0db7",
    "ecdcbae7-7a8c-4cd1-97d6-31732c5d0db7",
    "ecdcbae7-7a8c-4cd1-97d6-31732c5d0db7",
    "ecdcbae7-7a8c-4cd1-97d6-31732c5d0db7",
    "163962fe-6f67-408b-8f8a-5d11a0a8418f",
    "163962fe-6f67-408b-8f8a-5d11a0a8418f",
    "163962fe-6f67-408b-8f8a-5d11a0a8418f",
    "163962fe-6f67-408b-8f8a-5d11a0a8418f",
    "163962fe-6f67-408b-8f8a-5d11a0a8418f",
    "163962fe-6f67-408b-8f8a-5d11a0a8418f",
    "09c0ba40-bd01-4556-ada4-b599917b2557",
    "09c0ba40-bd01-4556-ada4-b599917b2557",
    "f36592fd-cbe2-46cc-997f-ff392550751b",
    "5140f2a2-8aed-4bf9-8fe9-46a12e38883e",
    "b0baec81-b267-430d-93fb-9a198d1e968e",
    "f0cba7dd-381d-4ee2-bb4b-8459d188ce1a"
  ],
  "legality": {
    "tcg": {
      "current": "unlimited"
    },
    "ocg": {
      "current": "unlimited"
    }
  },
  "masterDuel": {
    "rarity": "r",
    "craftable": true
  },
  "duelLinks": {
    "rarity": "r"
  },
  "externalIDs": {
    "yugipedia": [
      {
        "name": "Lekunga",
        "id": 16998
      }
    ],
    "dbID": 5564,
    "ygoprodeck": {
      "id": 62543393,
      "name": "lekunga-5288"
    },
    "yamlyugiID": 62543393
  },
  "series": []
}